[
  {
    "stableId": "UT-001",
    "method": "Quantity_CreateFractionalOptionContracts_IsRejected",
    "owningPhase": "Phase 2",
    "productionComponent": "Contract",
    "fixtureIds": [],
    "classification": "edge-case",
    "expectedPublicOutcome": "Option quantities cannot be fractional.",
    "safetyInvariant": "Option quantities cannot be fractional.",
    "implementationStatus": "NOT_IMPLEMENTED",
    "lastPassingCommit": null
  },
  {
    "stableId": "UT-002",
    "method": "Coverage_FromFractionalShares_CountsOnlyCompleteHundreds",
    "owningPhase": "Phase 2",
    "productionComponent": "Contract",
    "fixtureIds": [],
    "classification": "edge-case",
    "expectedPublicOutcome": "`99.999` yields zero blocks; `100.999` yields one.",
    "safetyInvariant": "`99.999` yields zero blocks; `100.999` yields one.",
    "implementationStatus": "NOT_IMPLEMENTED",
    "lastPassingCommit": null
  },
  {
    "stableId": "UT-003",
    "method": "OptionalValue_UnknownInvalidUnavailableAndZero_RemainDistinct",
    "owningPhase": "Phase 2",
    "productionComponent": "Contract",
    "fixtureIds": [],
    "classification": "normal-flow",
    "expectedPublicOutcome": "Four states survive mapping and JSON round-trip without coercion.",
    "safetyInvariant": "Four states survive mapping and JSON round-trip without coercion.",
    "implementationStatus": "NOT_IMPLEMENTED",
    "lastPassingCommit": null
  },
  {
    "stableId": "UT-004",
    "method": "Money_RoundAtDeclaredBoundary_UsesConfiguredRuleOnce",
    "owningPhase": "Phase 2",
    "productionComponent": "Contract",
    "fixtureIds": [],
    "classification": "edge-case",
    "expectedPublicOutcome": "Money is rounded exactly once at the declared boundary.",
    "safetyInvariant": "Money is rounded exactly once at the declared boundary.",
    "implementationStatus": "NOT_IMPLEMENTED",
    "lastPassingCommit": null
  },
  {
    "stableId": "UT-005",
    "method": "Ratio_DivideByZero_ReturnsInvalidNotInfinity",
    "owningPhase": "Phase 2",
    "productionComponent": "Contract",
    "fixtureIds": [],
    "classification": "normal-flow",
    "expectedPublicOutcome": "Invalid arithmetic cannot become a rankable value.",
    "safetyInvariant": "Invalid arithmetic cannot become a rankable value.",
    "implementationStatus": "NOT_IMPLEMENTED",
    "lastPassingCommit": null
  },
  {
    "stableId": "UT-006",
    "method": "ContractSchema_UnknownProperty_IsRejected",
    "owningPhase": "Phase 2",
    "productionComponent": "Contract",
    "fixtureIds": [],
    "classification": "normal-flow",
    "expectedPublicOutcome": "`additionalProperties: false` is enforced.",
    "safetyInvariant": "`additionalProperties: false` is enforced.",
    "implementationStatus": "NOT_IMPLEMENTED",
    "lastPassingCommit": null
  },
  {
    "stableId": "UT-007",
    "method": "ContractSchema_MissingRequiredProperty_IsRejected",
    "owningPhase": "Phase 2",
    "productionComponent": "Contract",
    "fixtureIds": [],
    "classification": "edge-case",
    "expectedPublicOutcome": "Missingness is not filled with a default.",
    "safetyInvariant": "Missingness is not filled with a default.",
    "implementationStatus": "NOT_IMPLEMENTED",
    "lastPassingCommit": null
  },
  {
    "stableId": "UT-008",
    "method": "ContractSchema_UnknownEnumValue_IsRejectedOrMigratedExplicitly",
    "owningPhase": "Phase 2",
    "productionComponent": "Contract",
    "fixtureIds": [],
    "classification": "normal-flow",
    "expectedPublicOutcome": "No permissive enum fallback enters Domain.",
    "safetyInvariant": "No permissive enum fallback enters Domain.",
    "implementationStatus": "NOT_IMPLEMENTED",
    "lastPassingCommit": null
  },
  {
    "stableId": "UT-009",
    "method": "CanonicalHasher_PropertyAndDictionaryOrderVaries_HashIsStable",
    "owningPhase": "Phase 2",
    "productionComponent": "Contract",
    "fixtureIds": [],
    "classification": "edge-case",
    "expectedPublicOutcome": "Semantically identical records produce the same hash.",
    "safetyInvariant": "Semantically identical records produce the same hash.",
    "implementationStatus": "NOT_IMPLEMENTED",
    "lastPassingCommit": null
  },
  {
    "stableId": "UT-010",
    "method": "CanonicalHasher_MaterialValueChanges_HashChanges",
    "owningPhase": "Phase 2",
    "productionComponent": "Contract",
    "fixtureIds": [],
    "classification": "edge-case",
    "expectedPublicOutcome": "Any executable or approval-bound value changes identity.",
    "safetyInvariant": "Any executable or approval-bound value changes identity.",
    "implementationStatus": "NOT_IMPLEMENTED",
    "lastPassingCommit": null
  },
  {
    "stableId": "UT-011",
    "method": "DecisionTime_ParseDifferentOffsets_RepresentsSameInstant",
    "owningPhase": "Phase 2",
    "productionComponent": "Contract",
    "fixtureIds": [],
    "classification": "edge-case",
    "expectedPublicOutcome": "Offset-equivalent timestamps normalize to one UTC instant.",
    "safetyInvariant": "Offset-equivalent timestamps normalize to one UTC instant.",
    "implementationStatus": "NOT_IMPLEMENTED",
    "lastPassingCommit": null
  },
  {
    "stableId": "UT-012",
    "method": "PersistedContract_OlderSupportedVersion_UsesExplicitMigrator",
    "owningPhase": "Phase 2",
    "productionComponent": "Contract",
    "fixtureIds": [],
    "classification": "edge-case",
    "expectedPublicOutcome": "Supported old data is migrated deliberately; unsupported versions fail visibly.",
    "safetyInvariant": "Supported old data is migrated deliberately; unsupported versions fail visibly.",
    "implementationStatus": "NOT_IMPLEMENTED",
    "lastPassingCommit": null
  },
  {
    "stableId": "UT-020",
    "method": "PortfolioEligibility_TransitionMatrix_AllDeclaredTransitionsMatchSpecification",
    "owningPhase": "Phase 1",
    "productionComponent": "StateMachine",
    "fixtureIds": [],
    "classification": "edge-case",
    "expectedPublicOutcome": "Theory covers every allowed source/event/target triple.",
    "safetyInvariant": "Theory covers every allowed source/event/target triple.",
    "implementationStatus": "NOT_IMPLEMENTED",
    "lastPassingCommit": null
  },
  {
    "stableId": "UT-021",
    "method": "PortfolioEligibility_InvalidTransition_EntersSafeHaltWithoutMutation",
    "owningPhase": "Phase 1",
    "productionComponent": "StateMachine",
    "fixtureIds": [],
    "classification": "normal-flow",
    "expectedPublicOutcome": "Invalid transitions do not invent an eligible state.",
    "safetyInvariant": "Invalid transitions do not invent an eligible state.",
    "implementationStatus": "NOT_IMPLEMENTED",
    "lastPassingCommit": null
  },
  {
    "stableId": "UT-022",
    "method": "OrderState_TransitionMatrix_AllBrokerStatusesNormalizeDeterministically",
    "owningPhase": "Phase 1",
    "productionComponent": "StateMachine",
    "fixtureIds": [],
    "classification": "normal-flow",
    "expectedPublicOutcome": "Covers `accepted`, `pending_new`, `new`, `held`, `accepted_for_bidding`, `partially_filled`, `done_for_day`, `pending_cancel`, `pending_replace`, `stopped`, `suspended`, `calculated`, `filled`, `canceled`, `expired`, `rejected`, and `replaced`.",
    "safetyInvariant": "Covers `accepted`, `pending_new`, `new`, `held`, `accepted_for_bidding`, `partially_filled`, `done_for_day`, `pending_cancel`, `pending_replace`, `stopped`, `suspended`, `calculated`, `filled`, `canceled`, `expired`, `rejected`, and `replaced`.",
    "implementationStatus": "NOT_IMPLEMENTED",
    "lastPassingCommit": null
  },
  {
    "stableId": "UT-023",
    "method": "OrderState_UnknownBrokerStatus_RequiresReconciliation",
    "owningPhase": "Phase 1",
    "productionComponent": "StateMachine",
    "fixtureIds": [],
    "classification": "normal-flow",
    "expectedPublicOutcome": "Future/unknown values fail closed rather than being treated as terminal.",
    "safetyInvariant": "Future/unknown values fail closed rather than being treated as terminal.",
    "implementationStatus": "NOT_IMPLEMENTED",
    "lastPassingCommit": null
  },
  {
    "stableId": "UT-024",
    "method": "OrderState_TerminalObservationFollowedByOlderEvent_DoesNotRegress",
    "owningPhase": "Phase 1",
    "productionComponent": "StateMachine",
    "fixtureIds": [],
    "classification": "edge-case",
    "expectedPublicOutcome": "Out-of-order observations cannot reopen a terminal order.",
    "safetyInvariant": "Out-of-order observations cannot reopen a terminal order.",
    "implementationStatus": "NOT_IMPLEMENTED",
    "lastPassingCommit": null
  },
  {
    "stableId": "UT-025",
    "method": "OrderState_TradeCorrectionOrBust_RecomputesCumulativeFill",
    "owningPhase": "Phase 1",
    "productionComponent": "StateMachine",
    "fixtureIds": [],
    "classification": "edge-case",
    "expectedPublicOutcome": "Corrected/busted activity changes derived fill state through a new observation.",
    "safetyInvariant": "Corrected/busted activity changes derived fill state through a new observation.",
    "implementationStatus": "NOT_IMPLEMENTED",
    "lastPassingCommit": null
  },
  {
    "stableId": "UT-026",
    "method": "OptionLifecycle_TransitionMatrix_AllDeclaredTransitionsMatchSpecification",
    "owningPhase": "Phase 1",
    "productionComponent": "StateMachine",
    "fixtureIds": [],
    "classification": "edge-case",
    "expectedPublicOutcome": "Every declared lifecycle event has one next state and next action.",
    "safetyInvariant": "Every declared lifecycle event has one next state and next action.",
    "implementationStatus": "NOT_IMPLEMENTED",
    "lastPassingCommit": null
  },
  {
    "stableId": "UT-027",